{
  "protocolVersion": "0.4",
  "id": "observation_fixture",
  "ownerId": "owner_fixture",
  "attemptId": "attempt_fixture",
  "environment": {
    "category": "execution_environment",
    "id": "environment_fixture",
    "version": "1.0.0",
    "environmentKind": "local",
    "manifest": {
      "id": "manifest_fixture",
      "version": "1.0.0",
      "digest": "sha256:f16d05ec6b29248d2c61adb1e9263f78e4f7bace1b955014a2d17872cfe4064d"
    }
  },
  "leaseId": "lease_fixture",
  "fencingGeneration": 1,
  "cancellationGeneration": 1,
  "sequence": 1,
  "kind": "ended",
  "payloadRef": null,
  "payloadDigest": null,
  "observedAt": "2026-08-13T12:00:03.000Z"
}
